{
  "supports": {
    "net46.app": { },
    "uwp.10.0.app": { },
    "dnxcore50.app": { }
  },
  "dependencies": {
    "Microsoft.NETCore.UniversalWindowsPlatform": "5.0.0"
  },
  "frameworks": {
    "uap10.0": {
      "imports": "portable-net452+win81",
      "dependencies": {
        "Newtonsoft.Json": "6.0.4"
      }
    }
  },
  "runtimes": {
    "win10-arm": { },
    "win10-arm-aot": { },
    "win10-x86": { },
    "win10-x86-aot": { },
    "win10-x64": { },
    "win10-x64-aot": { }
  }
}
